[
  {
    "id": "E01-A0001",
    "镜头": "E01-K001",
    "起": "00:01.0",
    "止": "00:01.5",
    "执行者": "C001",
    "动作": "走到会议桌旁，拉开椅子，把文件放到桌上",
    "对象": "桌面",
    "物件": null,
    "结果": "",
    "关键": true,
    "关键类别": 3,
    "依据帧": [
      "K001_01.jpg",
      "K001_02.jpg"
    ],
    "确定度": "确认",
    "说明": ""
  },
  {
    "id": "E01-A0002",
    "镜头": "E01-K002",
    "起": "00:05.0",
    "止": "00:05.5",
    "执行者": "C001",
    "动作": "右掌拍在桌面上",
    "对象": "桌面",
    "物件": null,
    "结果": "",
    "关键": true,
    "关键类别": 4,
    "依据帧": [
      "K002_01.jpg",
      "K002_02.jpg"
    ],
    "确定度": "确认",
    "说明": ""
  },
  {
    "id": "E01-A0003",
    "镜头": "E01-K004",
    "起": "00:15.0",
    "止": "00:15.5",
    "执行者": "C003",
    "动作": "从门口走到沈宁身旁，把信封递给沈宁",
    "对象": "C002",
    "物件": null,
    "结果": "",
    "关键": true,
    "关键类别": 1,
    "依据帧": [
      "K004_01.jpg",
      "K004_02.jpg"
    ],
    "确定度": "确认",
    "说明": ""
  },
  {
    "id": "E01-A0004",
    "镜头": "E01-K004",
    "起": "00:18.0",
    "止": "00:18.5",
    "执行者": "C002",
    "动作": "接过信封，低头查看",
    "对象": "信封",
    "物件": null,
    "结果": "",
    "关键": true,
    "关键类别": 1,
    "依据帧": [
      "K004_01.jpg",
      "K004_02.jpg"
    ],
    "确定度": "确认",
    "说明": ""
  }
]
