[
  {
    "起": "00:03.0",
    "止": "00:03.5",
    "执行者": "C001",
    "动作": "右掌拍在桌面上",
    "对象": "桌面",
    "物件": null,
    "结果": "水杯晃动",
    "id": "E01-A0001",
    "镜头": "E01-K001",
    "关键": true,
    "关键类别": 4,
    "依据帧": [
      "K001_01.jpg"
    ],
    "确定度": "确认",
    "说明": ""
  },
  {
    "起": "00:07.0",
    "止": "00:07.5",
    "执行者": "C002",
    "动作": "推开木门",
    "对象": "木门",
    "物件": null,
    "结果": "木门打开",
    "id": "E01-A0002",
    "镜头": "E01-K002",
    "关键": true,
    "关键类别": 3,
    "依据帧": [
      "K002_01.jpg"
    ],
    "确定度": "确认",
    "说明": ""
  },
  {
    "起": "00:11.0",
    "止": "00:11.5",
    "执行者": "C001",
    "动作": "举起文件",
    "对象": "文件",
    "物件": "文件",
    "结果": "文件举到胸前",
    "id": "E01-A0003",
    "镜头": "E01-K003",
    "关键": true,
    "关键类别": 4,
    "依据帧": [
      "K003_01.jpg"
    ],
    "确定度": "确认",
    "说明": ""
  },
  {
    "起": "00:15.0",
    "止": "00:15.5",
    "执行者": "C002",
    "动作": "把信封递给林舟",
    "对象": "C001",
    "物件": "信封",
    "结果": "林舟接住信封",
    "id": "E01-A0004",
    "镜头": "E01-K004",
    "关键": true,
    "关键类别": 1,
    "依据帧": [
      "K004_01.jpg"
    ],
    "确定度": "确认",
    "说明": ""
  }
]
